{
  "$schema": "https://json-schema.org/draft/2020-12/schema",
  "$id": "https://post-incident-proofs.local/schemas/pip/v1/MorphReplayReport.schema.json",
  "title": "MorphReplayReport",
  "description": "Local PIP subset of Morph branch-replay report fields. Does not vendor Morph runtime.",
  "type": "object",
  "additionalProperties": false,
  "required": [
    "schema_version",
    "replay_id",
    "branch_id",
    "replay_identity_digest",
    "input_artifact_digests",
    "output_artifact_digests",
    "status"
  ],
  "properties": {
    "schema_version": { "const": "pip.MorphReplayReport.v1" },
    "replay_id": { "type": "string", "minLength": 1 },
    "branch_id": { "type": "string", "minLength": 1 },
    "replay_identity_digest": {
      "type": "string",
      "pattern": "^sha256:[a-f0-9]{64}$"
    },
    "input_artifact_digests": {
      "type": "array",
      "items": { "type": "string", "pattern": "^sha256:[a-f0-9]{64}$" }
    },
    "output_artifact_digests": {
      "type": "array",
      "minItems": 1,
      "items": { "type": "string", "pattern": "^sha256:[a-f0-9]{64}$" }
    },
    "status": {
      "type": "string",
      "enum": ["recorded", "mismatch", "indeterminate"]
    },
    "lineage_node_ids": {
      "type": "array",
      "items": { "type": "string", "minLength": 1 }
    }
  }
}
